{
  "comment": "字段 ↔ 面向映射配置（Phase20 配置驅動架構）",
  "version": "1.0.0",
  "fields": [
    "founded_date",
    "address",
    "officer",
    "main_services",
    "business_items"
  ],
  "mapping": {
    "founded_date": "foundation",
    "address": "foundation",
    "officer": "foundation",
    "main_services": "core",
    "business_items": "core"
  },
  "aspects": [
    "foundation",
    "core",
    "vibe",
    "future"
  ]
}